key	title	publishingOrganizationKey	publishingOrganizationTitle	matched_keywords
bc350c7a-321d-4f52-8903-f27a49af839d	ACQUISITION_CBNMC - PHILIPPE Guy_fevrier 2012	1928bdf0-f5d2-11dc-8c12-b8a03c50a862	UAR PatriNat (OFB-MNHN-CNRS-IRD), Paris	
ea1d216e-e7eb-4234-93a2-434ffa6fb3cf	ACQUISITION_CBNMC - DAUGE Compléments	1928bdf0-f5d2-11dc-8c12-b8a03c50a862	UAR PatriNat (OFB-MNHN-CNRS-IRD), Paris	
79d8c57d-8148-4aab-b5bd-f833410454f0	ACQUISITION_CBNMC - ONF 15	1928bdf0-f5d2-11dc-8c12-b8a03c50a862	UAR PatriNat (OFB-MNHN-CNRS-IRD), Paris	
2ae1fe04-6f12-4766-bdee-50e5b2dc1148	Species within North Ayrshire from 1984 - Present	6020041c-686c-46dc-9fbe-ccdcad7d7ce7	North Ayrshire Countryside Ranger Service	
848182d0-f762-11e1-a439-00145eb45e9a	herbario	036cdc50-e7f5-11d9-9a0e-b8a03c50a862	Museo Nacional de Costa Rica	
3a1e6d69-9ec6-4dc9-bdaa-c2d77bc7e174	TWIC General Records (2015 - present)	bae1413a-7b3f-47cb-a24d-f1d61ba50fa3	The Wildlife Information Centre	
a451ff50-3c7e-4b07-88d5-8464f74e243c	ACQUISITION_CBNMC - Guy PHILIPPE_mars_2012	1928bdf0-f5d2-11dc-8c12-b8a03c50a862	UAR PatriNat (OFB-MNHN-CNRS-IRD), Paris	
43f37d70-f50e-4021-95ae-5b9526df2388	Bird Monitoring Data	6ae2738e-361d-4cb1-9a57-b6a63defe060	Costa Rica Bird Observatories	
4ecb3766-7a71-46e6-99fa-e8159c51116f	ACQUISITION_CBNMC - PAPUGA Guillaume_janvier 2012	1928bdf0-f5d2-11dc-8c12-b8a03c50a862	UAR PatriNat (OFB-MNHN-CNRS-IRD), Paris	
a69cf9df-1954-46ae-94cf-51698720c1a0	2023 - 2026 Species on the Edge Tern Monitoring Data	c71f0513-c95a-4e98-abad-0c222b87ec66	Royal Society for the Protection of Birds	
6926a608-d969-49f2-a800-1ad44b41893c	NE Scotland mollusc records 1800-2010	f13cb487-bf52-456f-a319-edc21642462c	North East Scotland Biological Records Centre	
8c602115-50f4-4a79-8b07-46c9545c0837	NE Scotland Wildcat records 1800-2011	f13cb487-bf52-456f-a319-edc21642462c	North East Scotland Biological Records Centre	
6ef41d6f-2ba4-4afc-8b80-b16632ebe47d	NE Scotland fish records 1800-2010	f13cb487-bf52-456f-a319-edc21642462c	North East Scotland Biological Records Centre	fish
83501c7f-a413-45c7-a5d5-c9bf94fa37ef	NE Scotland beetle records 1800-2014	f13cb487-bf52-456f-a319-edc21642462c	North East Scotland Biological Records Centre	
b005b9fb-85ed-4950-b96c-6b200cf559d6	Dragonflies and Damselflies 1862-2013	f13cb487-bf52-456f-a319-edc21642462c	North East Scotland Biological Records Centre	
a4b65ad0-4873-4f93-9dd0-f9f8101aede8	NE Scotland butterfly and moth records 1800-2010	f13cb487-bf52-456f-a319-edc21642462c	North East Scotland Biological Records Centre	
89fc85d7-1d30-4998-8dda-8033cb7d751c	North East Scotland Amphibians & Reptiles 1850 - 2016	f13cb487-bf52-456f-a319-edc21642462c	North East Scotland Biological Records Centre	
1e8db8c1-da20-4ca1-80ef-c0cff00bfa2c	Species on the Edge - 2023 onwards Greenland White-fronted Goose Counts	c71f0513-c95a-4e98-abad-0c222b87ec66	Royal Society for the Protection of Birds	
17a3e551-8814-4096-affd-d24a429516ad	Species on the Edge - Great Yellow Bumblebee Monitoring - Coll and Tiree	c71f0513-c95a-4e98-abad-0c222b87ec66	Royal Society for the Protection of Birds	
67bb72d9-267e-48fc-bb1c-858025c2f832	North East Scotland Invasive Non Native Plants	f13cb487-bf52-456f-a319-edc21642462c	North East Scotland Biological Records Centre	
2c27c186-4ce8-483c-8b4d-c3d98beaabd9	Stonefly (Plecoptera) Data for Great Britain for 1955-2005	125b5016-8748-43a8-ae03-632345d3262a	Riverfly Recording Schemes	
0a0d4ca1-5bfd-4594-9d51-40b972308bf5	NE Scotland other invertebrate records 1800-2010	f13cb487-bf52-456f-a319-edc21642462c	North East Scotland Biological Records Centre	
d09e131c-79c6-4605-b373-ce38383ea9d7	Natalie Harmsworth's Records (2010-2019)	bae1413a-7b3f-47cb-a24d-f1d61ba50fa3	The Wildlife Information Centre	
69e2efa0-4524-4f9e-86b7-a72f2a64980c	Species on the Edge - 2023 onwards O'Brien and Smith Wader Surveys - Site Totals	c71f0513-c95a-4e98-abad-0c222b87ec66	Royal Society for the Protection of Birds	
863c582c-d389-4eb7-b932-46cca2c55782	Species on the Edge - 2023 onwards O'Brien and Smith Wader Surveys - Field Totals	c71f0513-c95a-4e98-abad-0c222b87ec66	Royal Society for the Protection of Birds	
fed71ed2-bdd2-4df0-8d21-d86c4ab6c7a5	Colección de referencia del Laboratorio de Zooarqueología del INAPL (INAPL/LZ)	bd5be4d1-61e8-4928-8289-f89d6126093a	Instituto Nacional de Antropología y Pensamiento Latinoamericano	
956ac62a-cf65-4862-a28e-5da528e277af	Ferme éolienne de l'Algoux - Avifaune	1928bdf0-f5d2-11dc-8c12-b8a03c50a862	UAR PatriNat (OFB-MNHN-CNRS-IRD), Paris	
e5d51b5c-9a8c-43eb-9d8e-5d460c150792	Ferme éolienne de l'Algoux - Mammifères	1928bdf0-f5d2-11dc-8c12-b8a03c50a862	UAR PatriNat (OFB-MNHN-CNRS-IRD), Paris	
a30b85ec-f825-4dd8-be7c-c3c2041ce8e2	Suivi de mortalité sur l'avifaune et les chiroptères sur le parc éolien de Rageade II - Suivi la mortalité de l’avifaune et des chiroptères	1928bdf0-f5d2-11dc-8c12-b8a03c50a862	UAR PatriNat (OFB-MNHN-CNRS-IRD), Paris	
84ecc4aa-f762-11e1-a439-00145eb45e9a	European Lepidoptera Observations by Donald Hobern	2f462930-4d96-11d8-b290-b8a03c50a862	University of Helsinki - Department of Forest Sciences	
f9364cd0-4e7d-48de-a5b8-bcaa1e4fd1e4	NE Scotland fungus and lichen records 1800-2010	f13cb487-bf52-456f-a319-edc21642462c	North East Scotland Biological Records Centre	
14d06ecf-7604-4108-bb7f-2a95ca914f27	crm_provanna	bb922300-7ddb-11de-a300-90ac77aa923f	ZooKeys	
eeaf0bdb-30c4-4022-8ddd-6ec4761b4356	PROGRAMA DE BIODIVERSIDAD SOSTENIBLE DEL MANGLAR AL CORAL 2021-2050	36ddf48a-380c-4e24-8179-190808fa8e94	Universidad Espíritu Santo - UEES	coral
15bcb52b-eb1e-4231-8d14-2518c7276f25	Ferme éolienne de l'Algoux - Flore	1928bdf0-f5d2-11dc-8c12-b8a03c50a862	UAR PatriNat (OFB-MNHN-CNRS-IRD), Paris	
2bcc9a37-a4d2-473f-a38c-3fda75abd3e6	NSW Green and Golden Bell Frog Surveys	fc51dc03-28d0-491d-887e-c85cae77ec8b	The University of Newcastle	
96b66524-f762-11e1-a439-00145eb45e9a	Universidad de Oviedo. Departamento de Biología de Organismos y Sistemas: FCO-Algae	95cb537c-74c5-4c1e-ae24-32e7ea08f380	Department of Organisms and Systems Biology. University of Oviedo	
8697b93e-77fb-4123-b5d6-6f90cb52681c	Ferme éolienne de l'Algoux - Chiroptères identifiés au D240X lors d'écoutes au sol	1928bdf0-f5d2-11dc-8c12-b8a03c50a862	UAR PatriNat (OFB-MNHN-CNRS-IRD), Paris	
c9b3866a-efb9-4a34-9023-b44bd4f800f4	Ferme éolienne de l'Algoux - Chiroptères identifiés au Batcorder lors d'écoutes au sol	1928bdf0-f5d2-11dc-8c12-b8a03c50a862	UAR PatriNat (OFB-MNHN-CNRS-IRD), Paris	
37e36e7d-3a9f-427d-90bc-92e4b1bf3352	Ferme éolienne de l'Algoux - Insectes	1928bdf0-f5d2-11dc-8c12-b8a03c50a862	UAR PatriNat (OFB-MNHN-CNRS-IRD), Paris	
c58e37c4-90dd-49c1-b101-3ab9904d4854	Fisheries of western Lake Tanganyika in March 2024	b1670923-c90b-4420-be96-1db600ed2109	Lake Tanganyika Floating Health Clinic	fish
996ba8be-13a1-4361-9c37-559f9ea58399	North East Scotland Mosses and Liverworts (1950-2014)	f13cb487-bf52-456f-a319-edc21642462c	North East Scotland Biological Records Centre	
523261c9-3060-49e3-b26e-aef6fb7d2421	Ferme éolienne de l'Algoux - Herpétofaune	1928bdf0-f5d2-11dc-8c12-b8a03c50a862	UAR PatriNat (OFB-MNHN-CNRS-IRD), Paris	
f3e0c6b6-0bcc-4a3b-9ee6-1ca8d1098f7c	new_marphysa_species_from_east_coast_peninsular_malaysia	bb922300-7ddb-11de-a300-90ac77aa923f	ZooKeys	
451ea186-25c7-4839-92d3-fb9f012ffaae	La ballena jorobada, Megaptera novaeangliae, en la Península de Baja California Sur, México	ff90b050-c256-11db-b71b-b8a03c50a862	Comisión nacional para el conocimiento y uso de la biodiversidad	
1b476ab1-edfd-4f23-9b6b-6de99253020b	REEHAB Project - Irish Sabellaria alveolata Records	d2b97690-bfd6-11de-b279-d52977ace833	National Biodiversity Data Centre	
1850e2cd-37d5-4c56-9927-a20cae8acdc4	Monitoreos de fauna y flora silvestre en el área de explotación campos Careto y Arauco	591b93c8-b83c-45a4-8c8d-85728347a56c	Frontera Energy Colombia Corp	
1d3adc8c-879b-430e-bc4b-515cfaef9147	Projeto Abrace o Boto Cinza	0e777ade-4713-4470-8b6d-09ed6f6ea72e	Instituto Boto Cinza	
56b1a75f-6bf7-47ff-bcdb-a4d402172b1d	Registro de Ateles belzebuth (mono araña) en el municipio de Yopal, departamento de Casanare	c803f6f5-2c6a-4b41-8c15-768d48ef1c8c	ABC Colombia Somos Territorio	
14e259a2-7985-4001-b799-1dc177067ab1	Mayfly (Ephemeroptera) Data for Great Britain for 1906-2017	125b5016-8748-43a8-ae03-632345d3262a	Riverfly Recording Schemes	
97333283-df15-4a0e-8ce4-aeeecf3e643c	Censo de aves en el Santuario de Fauna y Flora los Colorados en el periodo 2008 a 2012	ab13adb9-ce23-444d-87c9-ce41f03ef2b3	Parques Nacionales Naturales de Colombia	
84eb976a-f762-11e1-a439-00145eb45e9a	Lepidoptera Observations from New Zealand by Donald Hobern	2f462930-4d96-11d8-b290-b8a03c50a862	University of Helsinki - Department of Forest Sciences	
ae1c0f69-c920-4a94-94d5-4a0b08966a86	Manx Bat Group records 1848 to 2023	7774fda0-457b-40da-8936-214f632ba991	Manx Biological Recording Partnership	
efb3f1a0-43d5-4ae6-a58f-4fd61043756a	National Trust for Scotland Species Records	90e9563c-9e64-40ba-910b-66100232a212	National Trust for Scotland	
71577ce3-32ea-4cf7-8046-b8ed4e098ffc	North East Scotland Birds (1883-2010)	f13cb487-bf52-456f-a319-edc21642462c	North East Scotland Biological Records Centre	
edef5b7c-7b72-4815-af4c-b9cc45b6416f	Hidrobiológicos asociados al Estudio de Impacto Ambiental (EIA) para la Planta de Tratamiento de Aguas Residuales de Neiva	7951352e-6306-4d78-8bd2-f37724dd385c	MCS CONSULTORÍA Y MONITOREO AMBIENTAL S.A.S.	
82d5383e-f90a-4619-9ee5-b8bdbbf7476f	Arachnida de Isla de los Estados, Tierra del Fuego, Argentina	5c4c3875-3b66-4a9a-bad3-3e9e28f82399	ICPA- UNTDF	
0aa0874c-fbf8-4211-8435-40f6b0cd8836	Institut Botanic de Barcelona (IBB), CSIC-CMCNB – BC-Vayreda	6f3ccc65-0a54-4e65-ae7e-13b92d618e7c	Institut Botànic de Barcelona (CSIC-CMCNB)	
ddddb635-36d6-4814-83d3-1ad7679c51cd	Ferme éolienne de l'Algoux - Chiroptères enregistrés au Batcorder en continu sur mât de mesure	1928bdf0-f5d2-11dc-8c12-b8a03c50a862	UAR PatriNat (OFB-MNHN-CNRS-IRD), Paris	
f9040e31-ee85-4b92-9963-a0272a44ec96	UFMT - Herbário UFMT	a84dccda-c5b2-4319-abbf-3c24601e89a2	Universidade Federal de Mato Grosso	
f11b55db-cf5d-484a-9acd-55e064e437fb	Tejidos colectados en la ventana de biodiversidad del Complejo Cenagoso de Zapatosa, Municipio de Chimichagua, Cesar, Colombia.	2a7e3080-28a9-11dd-97cd-b8a03c50a862	Instituto de Investigación de Recursos Biológicos Alexander von Humboldt	
87374e16-2fb0-4788-affa-0f30406cffb3	Colección Orthoptera y Dermaptera Antonio del Cerro (Museo de Zoología Ibérica Antonio Notario) UPM	46fca4d7-47a9-465f-97c8-161e209e624e	School of Forestry Engineering. Technical University of Madrid	
4673875f-24c0-49a0-9807-0e823c2089c0	Almejas de importancia comercial del Food quality research center	af9cb505-df2d-46cb-8d3d-81a926c660b6	Universidad de Chile	sea
5d06e33b-e884-4369-9a1a-fdc8bfa9471c	Seatrust Cetacean Records West Wales	29753c63-7ff1-455b-92ee-120bcfe9bce3	West Wales Biodiversity Information Centre	sea
2d2cadfc-c7e5-4378-ba65-44270cdc292b	Coleção de Ascidiacea da Universidade Federal do Paraná	f6e2efc9-42a3-47ea-99c6-3eda8d653cc9	Universidade Federal do Paraná	
06cb2d65-3dc1-4f9f-8e73-c4348abeba77	Panboola Wetlands Bird Surveys	3c5e4331-7f2f-4a8d-aa56-81ece7014fc8	Atlas of Living Australia	
323d7447-3981-411d-941d-589b547b837b	Ringing data of the 'Operation Baltic' Bird Migration Research and Monitoring Programme	e3f07310-a215-11da-beae-b8a03c50a862	University of Gdańsk	sea
dc17908c-0b22-4819-8949-a370900166a5	Houston Museum of Natural Science, Mammalogy Collection	ce49064e-b07f-4a50-9969-e7c83dd80fea	Houston Museum of Natural Science	
6b96cd8f-e4a4-4837-84be-eac2f2701d72	Sub-Antarctic subtidal and intertidal macroalgae in rocky ecosystems of Inútil Bay	ba7b835b-ec0d-4380-99a5-9065b4206868	Fundación Rewilding Chile	
94449a32-83f9-405d-af6a-bc010e7f49ea	Houston Museum of Natural Science, Ornithology Collection	ce49064e-b07f-4a50-9969-e7c83dd80fea	Houston Museum of Natural Science	
47b8b46b-5fc3-48b9-be20-31c0d872d83f	NCC - Sonoma State University Herbarium	007d5cf5-e26f-46fe-a3eb-acca2b612889	North Coast Herbarium of California	
9236fad5-b80c-4630-86e0-b289812c2016	Panboola Wetlands Mammals Survey	3c5e4331-7f2f-4a8d-aa56-81ece7014fc8	Atlas of Living Australia	
4cb8165d-2c33-442f-b948-ff038cf149e1	Taxonomic revision of Mordellistena hirtipes species-complex with new distributional records (Insecta, Coleoptera, Mordellidae)	bb922300-7ddb-11de-a300-90ac77aa923f	ZooKeys	
7fa4ed8c-e879-465f-acd2-2e65f398cc96	Tree Species Occurrence in Miombo Woodland of Tanzania.	a8864fd2-f4f9-40b1-bd9d-a8767e12b9ab	Sokoine University of Agriculture, Department of Ecosystems and Conservation	
086f071b-4e7b-47cc-a8cf-d8ba6fcc8f65	Aprovechamiento forestal del proyecto 'Subestación Cereté 110 kV y Línea de Transmisión Asociada', en 2018	f774c7c2-d092-4298-85fa-a7df5bda1912	Empresa Energía Eléctrica de la Costa Atlántica	
c7e70f26-ae82-44f0-91d1-77a8f4783118	Registros en cámaras trampa dentro del Distrito Regional de Manejo Integrado (DRMI) Bosques, Mármoles y Pantágoras	1106e179-e49f-461f-95a6-459bf4d53c1b	CORNARE - Corporación Autónoma Regional de las cuencas de los ríos Negro y Nare	
2aa6735e-274e-4d02-a013-482fc89d0888	Monitoreo de fauna y flora en el área de explotación Bloque Cravoviejo Orocué-Casanare	591b93c8-b83c-45a4-8c8d-85728347a56c	Frontera Energy Colombia Corp	
bf7d3b45-f000-499d-8dc6-e0d8f4c0d5e2	Terre d'huiles	0d6202e0-20fb-4099-8a47-de9f8e49c534	TERRE D'HUILES	
e6fb3d46-977a-4deb-99be-e8493024feb2	Vascular plants of Amrum 2007-2008	a344ee9f-f1b7-4761-be2c-58ee6d741395	Meise Botanic Garden	
1cfef5ce-5cb4-4701-9c66-bc365c6a1f00	Monitoreo Tití cabeciblanco en la Reserva Natural de la Sociedad Civil los Titíes de San Juan, San Juan Nepomuceno, Bolívar	e95d741a-e239-4b2c-9176-3d40ceecd5a3	Fundación Proyecto Tití	
324ca21e-71f1-4480-a09f-6f6f4a1ad5ba	McDonald-Podesta-Fortuin-Gandhi Orchid Bee Collection	062447f7-40ec-42af-9622-ee9170752dc3	University of Georgia Collection of Arthropods	
b971493e-dfe2-4945-b9e0-f41ebd6060b2	Medicinal potential of African plants (Togo)	d2583793-e5c1-41ae-83bd-86300d34e2cb	Université de Lomé	
527820c8-6737-408c-a0de-86fc9ce5e9f3	Monitoreo Tití cabeciblanco en el Parque Natural Regional El Ceibal Mono Tití, Santa Catalina de Alejandría, Bolívar	e95d741a-e239-4b2c-9176-3d40ceecd5a3	Fundación Proyecto Tití	
8774e060-1a9c-42a1-b9f8-2e408b0831fe	Registros de fauna para la conformación del Sistema Local de Áreas Protegidas (SILAP) en los municipios de San Vicente Ferrer y Cocorná	1106e179-e49f-461f-95a6-459bf4d53c1b	CORNARE - Corporación Autónoma Regional de las cuencas de los ríos Negro y Nare	
bc2c3c27-97b6-473e-abe0-6f8478b3e2f8	Colección de Invertebrados del Instituto de Investigación de Recursos Biológicos Alexander von Humboldt (IAvH-I)	2a7e3080-28a9-11dd-97cd-b8a03c50a862	Instituto de Investigación de Recursos Biológicos Alexander von Humboldt	
1bb3cae3-b91f-4109-8a2d-a1f05f2d6fd3	SPF - Herbário da Universidade de São Paulo	76dbcb10-efc5-4d5f-87a5-bcd409fc92c8	Universidade de São Paulo	
785da3a1-3b86-4ac2-8f68-0903cb1cd085	Duke University Vascular Plant Collection	ead371f0-f93d-11dd-af50-b8a03c50a862	Duke University Herbarium	
ddcc85ee-cb47-47a6-8789-711d6852145a	1994-2018 Capercaillie Brood Counts Data, Scotland	c71f0513-c95a-4e98-abad-0c222b87ec66	Royal Society for the Protection of Birds	
30f25223-4ab7-4471-babe-9544e06a3229	Algas coralinas articuladas (Rhodophyta-corallinales) de México	ff90b050-c256-11db-b71b-b8a03c50a862	Comisión nacional para el conocimiento y uso de la biodiversidad	coral
7f7b4eb7-a85f-464c-b6dc-01dc5a2cac96	Registros de Magnolias de la región amazónica	63da1b44-176a-4e9b-b418-28fcc182c676	Tecnológico de Antioquia	
528e60ab-0b7d-4395-856a-581cc8b33b71	Colección de Coleoptera (Tenebrionidae) del sureste de la Península Ibérica de la Universidad de Granada	cc69bc8a-3015-45af-971b-af69fe82ab2f	Dept. of Zoology, Faculty of Science, University of Granada	
04c42f78-51bd-4d70-8cbf-ef16964d2f34	Colección de Coleoptera (Scarabaeoidea) del sureste de la Península Ibérica de la Universidad de Granada	cc69bc8a-3015-45af-971b-af69fe82ab2f	Dept. of Zoology, Faculty of Science, University of Granada	
689385b6-a672-4919-a4cc-3365c9d5aceb	Caracterización biológica de la ventana de biodiversidad del Complejo Cenagoso de Zapatosa, Municipio de Chimichagua, Cesar, Colombia	2a7e3080-28a9-11dd-97cd-b8a03c50a862	Instituto de Investigación de Recursos Biológicos Alexander von Humboldt	
82cb293c-f762-11e1-a439-00145eb45e9a	Great Backyard Bird Count	95f1c5d0-8996-11d9-a962-b8a03c50a862	Avian Knowledge Network	
b8ce9e96-4300-4bf2-9279-cbbdbe2f95ad	Diversité et répartition des mammifères non-volants d'Auvergne (Groupe Mammalogique d'Auvergne - LPO Auvergne) - Données de Carnivores collectées ou analysées par le Groupe Mammalogique d’Auvergne.	1928bdf0-f5d2-11dc-8c12-b8a03c50a862	UAR PatriNat (OFB-MNHN-CNRS-IRD), Paris	
f7c09374-a733-4a02-b964-b9ae97894042	Línea de base de la diversidad del ají y rocoto peruano con fines de bioseguridad	89602091-d81d-460b-96a5-bbebd4d08529	Ministerio del Ambiente de Perú - MINAM	
3c089a4c-c5af-4fa0-b46f-1885036b82f4	Flora de las playas y dunas costeras de México	ff90b050-c256-11db-b71b-b8a03c50a862	Comisión nacional para el conocimiento y uso de la biodiversidad	
df9129f4-0110-4930-a299-6c66873aaa72	Monitoreo Tití cabeciblanco en la zona de amortiguación de Reserva Forestal Protectora la Serranía de Coraza y Montes de María (CORAZA), jurisdicción del municipio de Colosó, Sucre	e95d741a-e239-4b2c-9176-3d40ceecd5a3	Fundación Proyecto Tití	
5e6facb4-4d88-487c-bffa-3f2e853d9382	Monitoreo comunitario del sapo andino de Coloma (Rhaebo colomai) y el cucharillo de Barbacoas (Magnolia sp.) en la KBA Reserva Natural Río Ñambí	b8dd52c4-153c-4501-aad5-f3f4d0557d02	Fundación Ecológica Los Colibríes de Altaquer (FELCA)	
2843d5a1-ccef-4d45-8422-6478d2f7b53e	Densidad poblacional para aves y mamíferos medida por medio de cámaras trampa en el Parque Nacional Natural Las Orquídeas	ab13adb9-ce23-444d-87c9-ce41f03ef2b3	Parques Nacionales Naturales de Colombia	
fc6bc8a4-2829-44c7-9b5b-fc9fbd440b96	Institut Botanic de Barcelona (IBB), CSIC-CMCNB – BC-ICHN	6f3ccc65-0a54-4e65-ae7e-13b92d618e7c	Institut Botànic de Barcelona (CSIC-CMCNB)	
d5f9da7b-611a-485f-845c-0d66c3249f48	Coleção de Répteis da Universidade Federal de Juiz de Fora	303e2432-448c-41ec-be2b-020a25c7adc4	Universidade Federal de Juiz de Fora	
e522ac84-5da1-4c70-b423-437c6dd801a1	Las tortugas marinas y sus playas de anidación en México	ff90b050-c256-11db-b71b-b8a03c50a862	Comisión nacional para el conocimiento y uso de la biodiversidad	
69fcbdcb-3b37-47a1-936d-d6e45f35f604	MUTPL Invertebrate Collection	9fff025a-f223-4b26-8ee1-2266b219934f	Museo de Zoología, Universidad Técnica Particular de Loja	
75bcca47-d2da-411f-b093-271fa99ce909	Muestreo de epífitas vasculares y no vasculares para el Estudio de Impacto Ambiental conexión vial puente Arimena - Puerto Carreño del Tramo 2: El viento - San Teodoro	d3c29fed-bcac-4f84-8d3d-f4b7f76fdc8e	Construcciones y Ambiente Conambiente S.A.S	
a644bd18-f0a9-45d9-bc7c-f005fee5aba0	Recolectas ocasionales de fauna realizadas alrededor de la Universidad Icesi	7d91f9bd-f6cd-48e3-ba81-3c228cf5e13a	Universidad Icesi	
9f6b46fb-f776-4bc4-b11d-7ed23a84f610	Transparencia de copa de Mariania sp y Andesanthus sp de la colección viva del Jardín Botánico José Celestino Mutis	eace4687-50e8-4f9a-829b-29ff8ff1fa8b	Jardín Botánico de Bogotá ""José Celestino Mutis""	
80c10738-f762-11e1-a439-00145eb45e9a	Helmintos parásitos de peces de lagunas costeras de Jalisco, México	ff90b050-c256-11db-b71b-b8a03c50a862	Comisión nacional para el conocimiento y uso de la biodiversidad	
7fba982c-f762-11e1-a439-00145eb45e9a	Crustáceos estomatópodos, anfípodos, isópodos y decápodos del litoral de Quintana Roo	ff90b050-c256-11db-b71b-b8a03c50a862	Comisión nacional para el conocimiento y uso de la biodiversidad	
f4fbbdde-b764-413f-93ee-76e9e47ed5d0	Simultaneous surveys of littoral organisms in Osaka Bay	4fd82480-ea1c-11da-8db4-b8a03c50a862	National Museum of Nature and Science, Japan	
2d4204c7-fd45-4104-8b26-5b05eb17e93a	Monitoreo de la fauna asociada a un relicto de Bosque húmedo tropical en el año 2023	e4a87e1f-4ff8-4d2e-bcd1-0929678abab9	Instituto Universitario de la Paz	
49ee840f-3ca1-442c-a93d-2ea88e6b478f	Monitoreo de abejas como grupo indicador de adicionalidad en las reforestaciones de los bloques Corcel y Casimena	591b93c8-b83c-45a4-8c8d-85728347a56c	Frontera Energy Colombia Corp	
1d27748d-d64a-436d-8bdf-a8d2b07d51f0	Aislamiento de Colletotrichum spp. a partir de Persea americana infectado, realizado en Bucaramanga, Santander	112087f6-a6c0-4cee-8441-387f900d34f9	Universidad de Santander - UDES	sea
3021152d-571e-477e-8b22-e11f9b2e1ca4	Colección general del plantas vasculares del Herbario JBB	eace4687-50e8-4f9a-829b-29ff8ff1fa8b	Jardín Botánico de Bogotá ""José Celestino Mutis""	
224f87f5-79f8-431b-9fb7-a5bc78e2e666	Detección de patógenos emergentes (SARS-CoV-2) y re-emergentes (Rickettsias) en caninos procedentes del área metropolitana de Bucaramanga	112087f6-a6c0-4cee-8441-387f900d34f9	Universidad de Santander - UDES	
8137cfd2-08a5-452e-b64a-80b9dffa9c26	Estudio ecológico y genético de las poblaciones de Rhizophora mangle en México	ff90b050-c256-11db-b71b-b8a03c50a862	Comisión nacional para el conocimiento y uso de la biodiversidad	
80c4befa-f762-11e1-a439-00145eb45e9a	Respaldo de las colecciones de tejidos del Museo de Zoología, Departamento de Biología Evolutiva, Facultad de Ciencias, UNAM (Aves)	ff90b050-c256-11db-b71b-b8a03c50a862	Comisión nacional para el conocimiento y uso de la biodiversidad	
80b7e6b2-f762-11e1-a439-00145eb45e9a	Respaldo de las colecciones de tejidos del Museo de Zoología, Departamento de Biología Evolutiva, Facultad de Ciencias, UNAM (Herpetofauna)	ff90b050-c256-11db-b71b-b8a03c50a862	Comisión nacional para el conocimiento y uso de la biodiversidad	
bdfbe989-5262-4c43-92bf-7020ebb1b7b4	Registros de fauna y flora asociados al proyecto 'Subestación Cereté 110 kV y Línea de Transmisión Asociada', en el marco del Estudio de Impacto Ambiental de 2016	f774c7c2-d092-4298-85fa-a7df5bda1912	Empresa Energía Eléctrica de la Costa Atlántica	
95ed754e-2c50-4a54-bbb2-aca8069eb9a1	Monitoreo de fauna y flora en el área de explotación de hidrocarburos campo Quifa Noroeste en el municipio de Puerto Gaitán-Meta, año 2023-2025	591b93c8-b83c-45a4-8c8d-85728347a56c	Frontera Energy Colombia Corp	
baf0dd21-64e7-46ea-95d0-e359c2f8e61b	Fauna asociada a plantaciones de palma de aceite en Guatemala	5c1a4c27-795a-4294-aecc-46d7176706b7	Universidad del Valle de Guatemala	
cd87f553-e879-4ef7-a3b1-77c349df5dcb	Caracterización de flora vascular y no vascular de hábito epífito y otros hábitos en veda asociada al proyecto Redes Subterráneas Caldas	d42b7e5d-a3e5-4fc2-8b3d-105336d70898	Empresas Públicas de Medellín E.S.P.	
5d84c775-ec77-48ae-ba57-404545bdd24e	Caracterización de flora epífita vascular y no vascular y otros hábitos en veda del proyecto Expansión El Noral	d42b7e5d-a3e5-4fc2-8b3d-105336d70898	Empresas Públicas de Medellín E.S.P.	
493d62af-2d99-4f15-ad86-45916d3b0969	Caracterización de flora vascular y no vascular de hábito epífito y otros hábitos en veda asociada al proyecto Tanques de almacenamiento Las Flores y La Piñuela	d42b7e5d-a3e5-4fc2-8b3d-105336d70898	Empresas Públicas de Medellín E.S.P.	
6c4ad3d8-46d4-4e13-81c9-be1015b8b108	Estudio genómico de los  abejorros neotropicales Bombus pauloensis y Bombus pullatus	32894589-242a-43f3-b262-33a5bded0e6c	Fundación Abood Shaio	
277a28b1-c359-49a8-a094-428af1a9f3c7	Aislamiento e identificación de hongos contaminantes en panela proveniente de Bucaramanga, Santander	112087f6-a6c0-4cee-8441-387f900d34f9	Universidad de Santander - UDES	
6f6e4924-905a-4721-b6c9-38c887116862	Aislamiento e identificación de hongos ambientales en el campus de la Universidad de Santander - UDES	112087f6-a6c0-4cee-8441-387f900d34f9	Universidad de Santander - UDES	
81f01194-4af0-4eb4-aae1-cd1a8613ef9e	Relevamiento de la Herpetofauna (anfibios y reptiles) en hábitats asociados a actividad minera: Alto Caribona, Municipio de Montecristo - Sur de Bolívar	112087f6-a6c0-4cee-8441-387f900d34f9	Universidad de Santander - UDES	
9b765768-c40b-472d-b787-ed51c3981951	Simultaneous surveys of littoral organisms in Osaka Bay in 2024	4fd82480-ea1c-11da-8db4-b8a03c50a862	National Museum of Nature and Science, Japan	
668d3577-f727-4526-aebe-9f6c7ef449ae	Botanical Research Institute of Texas - Lichens	c4cbb860-e9c7-11da-8113-b8a03c50a862	Botanical Research Institute of Texas	sea
ed3d96f2-db7b-48cd-9960-f871e7df7286	SBBG - Clifton Smith Herbarium, Santa Barbara Botanic Garden	48558fd5-e402-4362-ba91-7c742c96a26c	Santa Barbara Botanic Garden	
a4899898-3fb7-4474-85bf-be8975e6ba12	The Davidson College Entomology Collection	e0ce1efd-0221-4edc-bf69-12699d4f238c	Davidson College	
6cd25714-849f-4240-a762-ef33aa2e5db5	Duke University Herbarium Fungal Collection	ead371f0-f93d-11dd-af50-b8a03c50a862	Duke University Herbarium	
9f23be2d-ee86-4d72-892a-f8d0d4dc27e7	Colección de plantas del Herbario Padre Luis Sodiro (QPLS)	7696b31f-a7bd-4a3e-8732-106fcf9211c8	Centro Cultural Biblioteca Aurelio Espinosa Pólit	
9b495024-aa9e-4ac5-a33a-d589f4d7ce81	Base de datos de las familias Compositae y Umbelliferae. Donación del Herbario Kew	ff90b050-c256-11db-b71b-b8a03c50a862	Comisión nacional para el conocimiento y uso de la biodiversidad	
218bc953-e45c-41a4-87a9-d96a3bf94497	Evaluación de la bioacumulación de Cadmio y Plomo con cepas de hongos mitospóricos de origen ambiental	112087f6-a6c0-4cee-8441-387f900d34f9	Universidad de Santander - UDES	
