key	title	publishingOrganizationKey	publishingOrganizationTitle	matched_keywords
ff2ed94e-45ee-4dde-8e1f-0a4798f61a12	Mollusc collection at Museum of New Zealand Te Papa Tongarewa	afae4f45-b85e-4a0e-9d93-f30f044e8140	Museum of New Zealand Te Papa Tongarewa	
f29f9046-26d0-4ddd-8ea0-4e23d11e2544	Réhabilitation d'une friche industrielle - Ancien site CEA à Courtry (77) - Inventaires complémentaires faune	1928bdf0-f5d2-11dc-8c12-b8a03c50a862	UAR PatriNat (OFB-MNHN-CNRS-IRD), Paris	
cc30b707-47e9-455c-aeae-600800a2106e	SEPE Fontaine le Sec - Avifaune 2014 (Prénuptial, postnuptial, hivernage, reproduction)	1928bdf0-f5d2-11dc-8c12-b8a03c50a862	UAR PatriNat (OFB-MNHN-CNRS-IRD), Paris	
e32c9819-868d-4f0d-874a-f75626b0b5cb	Inventaires des Fourmis du Limousin-Contribution d'entomologistes de la SEL	1928bdf0-f5d2-11dc-8c12-b8a03c50a862	UAR PatriNat (OFB-MNHN-CNRS-IRD), Paris	
e81a4718-c998-4bf3-83b9-128d293ce31e	Arthropod diversity in the tea ecosystem of North-Eastern Bangladesh	e1eabdc9-2215-49ed-bfd1-9c8ddf819277	Sylhet Agricultural University	
bd6f60b4-44af-4b73-b1eb-5fc9c6f9d843	Mesures compensatoires du site Jallère et ses abords-Suivi Rhopalocères	1928bdf0-f5d2-11dc-8c12-b8a03c50a862	UAR PatriNat (OFB-MNHN-CNRS-IRD), Paris	
f79d8b83-cf33-45d1-9f3f-7d4cf1677a28	Mesures compensatoires du site Jallère et ses abords-Suivi Odonates	1928bdf0-f5d2-11dc-8c12-b8a03c50a862	UAR PatriNat (OFB-MNHN-CNRS-IRD), Paris	
cb47d109-ca60-4362-a9ea-5db81e4af939	Mesures compensatoires du site Jallère et ses abords-Suivi quotidien	1928bdf0-f5d2-11dc-8c12-b8a03c50a862	UAR PatriNat (OFB-MNHN-CNRS-IRD), Paris	
70b7c7b1-fbea-4771-8b63-ee1c7fae393d	Scottish river macro-invertebrate records from 2007 collected by SEPA	0c167c76-464a-406e-8d0b-c6dd8314da18	Scottish Environment Protection Agency	
b2a5958f-5d9a-43ce-9897-2c9302abf3c9	Programme Natura 2000 : Vallée de l'Epte francilienne et ses affluents-Programme Natura 2000 : Cartographie des végétations de la Vallée de l'Epte francilienne et ses affluents	1928bdf0-f5d2-11dc-8c12-b8a03c50a862	UAR PatriNat (OFB-MNHN-CNRS-IRD), Paris	
f37bf1a6-2944-4964-862f-4a4e50888d41	Fauna y flora en las cercanías del gasoducto que alimenta la mina de Ferroníquel Cerro Matoso S.A.	1a4f4e64-eb3d-42c3-a359-1be3869b3a20	Cerro Matoso S.A	
89e0c8c6-969e-46a2-b82f-16c24f57bb04	Diversity and community structure of pelagic cnidarians in south-east Asian tropical marginal Seas	4fd82480-ea1c-11da-8db4-b8a03c50a862	National Museum of Nature and Science, Japan	sea
930d4b3d-7159-475a-9138-ff9520664418	Registros de flora prioritaria de conservación en áreas de gestión de Forestal Arauco S.A.	403849cf-33b7-492e-8b36-11a5a714db69	ARAUCO	
95da13d0-f762-11e1-a439-00145eb45e9a	Estonian Museum of Natural History fossil collections	70488160-b003-11d8-a8af-b8a03c50a862	Geocollections of Estonia	
f7d60913-133f-45c4-9a12-55a62bb5a8b4	Bird of prey nests for protection	39adeab9-6ec9-4c56-801e-7144d0eb630c	Finnish Museum of Natural History - Zoology Unit	
5783428b-f8fe-499b-9123-40cff957731b	Monocotiledóneas del cerro Tacarcuna-Chocó, en el marco del proyecto Colombia BIO 2017	e1050db2-9faf-4d72-b860-295debaf9d2a	Instituto de Investigaciones Ambientales del Pacífico John Von Neumann - IIAP	
52c719a1-f150-454b-bde2-884a5f028d7b	Dataset of the model species from the spontaneous flora of the Forest-Steppe and the Steppe zones of Ukraine	5f5b96f6-73a7-475d-87ac-c968053f6dfe	M.G. Kholodny Institute of Botany, National Academy of Sciences of Ukraine	
72fa796a-29c3-4805-86c3-9380be2cc5a9	Biodiversidad asociada a la mina de explotación y producción de Ferroníquel Cerro Matoso S.A.	1a4f4e64-eb3d-42c3-a359-1be3869b3a20	Cerro Matoso S.A	
de0b1cd2-142e-4a22-961f-a2edc36a2ed9	Records of vascular plants at the old cemeteries in the Right-Bank of Dnipro Grass Steppe District (Southern Ukraine)	adc3d841-aefb-4d7c-9ab1-2156d614b27b	Kherson State University	
38f7fda0-b139-4285-ae61-d58f075b54d1	Proyecto de cultivo extensivo y comercialización de las mariposas de la región de Chajul, Chiapas	ff90b050-c256-11db-b71b-b8a03c50a862	Comisión nacional para el conocimiento y uso de la biodiversidad	
7fe58438-f762-11e1-a439-00145eb45e9a	Consolidación y sistematización de las colecciones de referencia de peces y mamíferos marinos del ITESM Campus Guaymas	ff90b050-c256-11db-b71b-b8a03c50a862	Comisión nacional para el conocimiento y uso de la biodiversidad	
987fc6a5-1a11-452b-be14-b89e027fa3e4	La mastofauna del cuaternario tardío de México	ff90b050-c256-11db-b71b-b8a03c50a862	Comisión nacional para el conocimiento y uso de la biodiversidad	
fd9fe4df-664a-45e4-bf3b-5be0fb32dbe0	CTMA de la Vienne médiane et ses affluents 2015-2020-250_BALL	1928bdf0-f5d2-11dc-8c12-b8a03c50a862	UAR PatriNat (OFB-MNHN-CNRS-IRD), Paris	
5668cd40-0f57-4024-9e16-4d1d1dd27ab8	CTMA de la Vienne médiane et ses affluents 2015-2020-195_ROMP	1928bdf0-f5d2-11dc-8c12-b8a03c50a862	UAR PatriNat (OFB-MNHN-CNRS-IRD), Paris	
b33e446b-41c9-46a7-971c-3046e06fc241	Selected Scottish freshwater fish records from 2008-2011 (collected by SEPA)	0c167c76-464a-406e-8d0b-c6dd8314da18	Scottish Environment Protection Agency	fish
87c4844b-c7a0-4174-a561-587db40a0c1f	CTMA de la Vienne médiane et ses affluents 2015-2020-153_BORD	1928bdf0-f5d2-11dc-8c12-b8a03c50a862	UAR PatriNat (OFB-MNHN-CNRS-IRD), Paris	
f28b3f13-3d15-4193-a930-1033b1f80a03	CTMA de la Vienne médiane et ses affluents 2015-2020-155_POUI	1928bdf0-f5d2-11dc-8c12-b8a03c50a862	UAR PatriNat (OFB-MNHN-CNRS-IRD), Paris	
f377e059-b05a-41c2-80c7-ba5f59d51b32	CTMA de la Vienne médiane et ses affluents 2015-2020-139_GLAN	1928bdf0-f5d2-11dc-8c12-b8a03c50a862	UAR PatriNat (OFB-MNHN-CNRS-IRD), Paris	
ca7cf509-de9e-4748-9b67-92b211a50669	CTMA de la Vienne médiane et ses affluents 2015-2020-236_SOUR	1928bdf0-f5d2-11dc-8c12-b8a03c50a862	UAR PatriNat (OFB-MNHN-CNRS-IRD), Paris	
51d74c04-99f6-45dc-8542-5e26ea47ff0c	CTMA de la Vienne médiane et ses affluents 2015-2020-140_NIEU	1928bdf0-f5d2-11dc-8c12-b8a03c50a862	UAR PatriNat (OFB-MNHN-CNRS-IRD), Paris	
ecef807e-4eab-4bed-8081-4f7429f48e8d	Mesures compensatoires du site Jallère et ses abords-Suivi Passereaux nicheurs	1928bdf0-f5d2-11dc-8c12-b8a03c50a862	UAR PatriNat (OFB-MNHN-CNRS-IRD), Paris	
f99e13c4-7b2e-435b-9f6d-fef9e014a0f2	Caithness and Sutherland Peatlands SPA wader surveys 2023 final report data	98ba8467-5081-4d15-b168-32d893e18b76	NatureScot	
79066b93-8f98-4bc5-9d23-64ec6ee640db	Macroinvertebrados acuáticos asociados a humedales del Cerro Galápagos, San José del Palmar, Chocó - 2018	e1050db2-9faf-4d72-b860-295debaf9d2a	Instituto de Investigaciones Ambientales del Pacífico John Von Neumann - IIAP	
c2d7a6a1-420c-4bb9-9f09-0aeded3204b3	CTMA de la Vienne médiane et ses affluents 2015-2020-203-CHDO	1928bdf0-f5d2-11dc-8c12-b8a03c50a862	UAR PatriNat (OFB-MNHN-CNRS-IRD), Paris	
2f7e9c01-e04a-4cb5-b3d8-61de6c9d7b69	A data set of non-flowering seed producing plants at TAFORI herbarium	76905ca0-1e21-11de-9ca0-cd203b273f5d	TanBIF	
c0fd9f28-9f1c-436d-9f36-dbafb9f4a276	Mesures compensatoires du site Jallère et ses abords-Pollutions, Mortalité Faune aquatique	1928bdf0-f5d2-11dc-8c12-b8a03c50a862	UAR PatriNat (OFB-MNHN-CNRS-IRD), Paris	
73db9279-966f-4029-9cdb-0c491e7da518	FBIP: Arachnid biodiversity of the Tshivhase and Makumbani Tea Plantations, Limpopo Province	c5f7ef70-e233-11d9-a4d6-b8a03c50a862	South African National Biodiversity Institute	
e9f1c16b-cf84-485c-b0e0-962b0e2026d1	Parc photovoltaique à Meounes-les-Montrieux - Inventaires naturalistes Méounes (et ses abords)	1928bdf0-f5d2-11dc-8c12-b8a03c50a862	UAR PatriNat (OFB-MNHN-CNRS-IRD), Paris	
8795ab31-79ae-4a9c-b285-0b76e5c09b9e	Occurrence data set for wild food plant species in Zimbabwe's biodiversity hotspots	30e59560-2a13-41cb-bfb2-4cc567c8698f	Bindura University Of Science Education	
3e95aa8e-a40c-4d34-ad11-7560484f1ff9	Tree Diversity and Dynamics of the Forest of Seu Nico (Brazil/MG)	9e1ad169-1f58-48fb-ad7a-3b2b4544d875	Laboratory of Ecology and Evolution of Plants, at Universidade Federal de Vicosa	
a58b5ac4-0570-4ce4-b67b-077d43460cce	GYPSUM LICHENS: a global data set of lichen species from gypsum ecosystems	88dc5c67-b496-4dec-a361-3deee558a552	Universidad Rey Juan Carlos	
876e5651-4e45-4c36-a665-04761e3b07c4	Survey of giant hogweed, Japanese knotweed and Himalayan balsam on 5 major Lothian rivers, 2003/04	98ba8467-5081-4d15-b168-32d893e18b76	NatureScot	
6313c4ae-7b7e-4c73-92db-8b9910c0c6c2	Distribution of Aureoboletus projectellus in Europe	04665d80-7e5f-11d8-a1a0-b8a03c50a862	University of Warsaw	
c9671fc1-7061-4a35-8c0c-1ed103e9fa92	Floral Diversity of the various wetlands and its associated area of Purba Medinipur, West Bengal, January 2021.	ba5d0858-075a-430b-b314-ff1debdfb6ec	Nature Mates-Nature Club	
805e193e-f762-11e1-a439-00145eb45e9a	Las comunidades de myxomicetes de selva baja caducifolia	ff90b050-c256-11db-b71b-b8a03c50a862	Comisión nacional para el conocimiento y uso de la biodiversidad	
ea9ad89e-4452-4ba2-86fe-d7b5b4f777e9	Conservación de serpientes de cascabel de la península e islas del Golfo de California y del Pacífico	ff90b050-c256-11db-b71b-b8a03c50a862	Comisión nacional para el conocimiento y uso de la biodiversidad	
d881b95c-dd14-4555-86db-d91ff5283c59	Monitoreo y uso del hábitat de aves neárticas y neotropicales asociados a ambientes acuáticos litorales en el municipio de Tomatlán, Jalisco, México	ff90b050-c256-11db-b71b-b8a03c50a862	Comisión nacional para el conocimiento y uso de la biodiversidad	
804d6fee-f762-11e1-a439-00145eb45e9a	Formación de la colección de referencia de anfibios y reptiles de la Reserva de la Biosfera de Sian Ka'an	ff90b050-c256-11db-b71b-b8a03c50a862	Comisión nacional para el conocimiento y uso de la biodiversidad	
775f7aae-521d-4b90-a1d2-69f491b181bf	Monitoreo de Fauna Silvestre Época Seca y de pasos de fauna del Área de Producción VIM8 (2024)	4189e371-1194-4c5d-9073-093ab88897ac	HOCOL S.A.	
38fdd8b7-4e48-452c-8c05-673e6f6829af	Coleoptera of Togo: data of the LEA Insect Collection of the University of Lome	d2583793-e5c1-41ae-83bd-86300d34e2cb	Université de Lomé	
a451e2eb-f70f-49c4-b1ca-fe78e65bacbe	Calf of Man (Isle of Man) Bird Observatory Daily Logs, 1959-2004	d7daeaec-a572-406f-ac6f-d7798ce2a4c3	Manx National Heritage	
f8f4c490-8ab3-4e27-b871-944fb807bc1b	White-tailed eagle reintroduction in Scotland, 1975 onwards - Sightings data	c71f0513-c95a-4e98-abad-0c222b87ec66	Royal Society for the Protection of Birds	
b7dd8170-98a0-11de-b4d9-b8a03c50a862	The Fish Database of Taiwan	7050ce20-c75e-11dd-87ef-b8a03c50a862	TELDAP	fish
0ac3a3c7-bd73-4ea0-98ba-7497a9c156bb	Macroinvertebrados acuáticos asociados a fuentes hídricas en Buenaventura, Valle del Cauca. EPA-IIAP 2019	e1050db2-9faf-4d72-b860-295debaf9d2a	Instituto de Investigaciones Ambientales del Pacífico John Von Neumann - IIAP	
7221810e-52b1-459d-a6a4-02160c67feef	Øvre Heimdalsvatn, Radiocaesium (Cs-137) monitored annually in brown trout (Salmo trutta)	f314b0b0-e3dc-11d9-8d81-b8a03c50a862	University of Oslo	
f84805f1-8d56-4a22-8804-62d591aea2ff	Fauna y flora asociada al Plan de Ordenación y Manejo Ambiental de la cuenca del río Cravo Norte, jurisdicción del departamento de Arauca	66739018-f8c3-4902-96d5-82c0aec31d6a	Corporación Autónoma Regional de la Orinoquia - Corporinoquia	
5000c6ca-d69a-4cc7-a4d2-1747803ce7e1	Estudio taxonómico y zoogeográfico de áreas selectas de peces marinos en Laguna Madre y Costas de Tamaulipas, Veracruz y Campeche, México	ff90b050-c256-11db-b71b-b8a03c50a862	Comisión nacional para el conocimiento y uso de la biodiversidad	
b860846c-b8b0-4f13-9434-9684c7a0ef62	[SUIVI] 2021 - Exploitation de la carrière de la société BABOUILLARD Michel SARL - Flore - ENCEM - Coulmier-le-sec - 2021	1928bdf0-f5d2-11dc-8c12-b8a03c50a862	UAR PatriNat (OFB-MNHN-CNRS-IRD), Paris	
19862773-542c-49d5-8913-f18965f1c077	[SUIVI] 2021 - Exploitation de la carrière de la société BABOUILLARD Michel SARL - Mammifères - ENCEM - Coulmier-le-sec - 2021	1928bdf0-f5d2-11dc-8c12-b8a03c50a862	UAR PatriNat (OFB-MNHN-CNRS-IRD), Paris	
6b570167-f671-4fe8-8a2f-dde0b62e6ee6	[SUIVI] 2021 - Exploitation de la carrière de la société BABOUILLARD Michel SARL - Reptiles - ENCEM - Coulmier-le-sec - 2021	1928bdf0-f5d2-11dc-8c12-b8a03c50a862	UAR PatriNat (OFB-MNHN-CNRS-IRD), Paris	
983045c8-7ae9-4271-bd1e-439ff4ac9e61	[SUIVI] 2021 - Exploitation de la carrière de la société BABOUILLARD Michel SARL - Oiseaux - ENCEM - Coulmier-le-sec - 2021	1928bdf0-f5d2-11dc-8c12-b8a03c50a862	UAR PatriNat (OFB-MNHN-CNRS-IRD), Paris	sea
ea39fa9f-51bd-40ac-967b-95a679e2dd3b	ATELIER VOLAILLES DE CHAIR SCEA AVIPAUL-Inventaire de taxons floristiques sur la zone d'étude	1928bdf0-f5d2-11dc-8c12-b8a03c50a862	UAR PatriNat (OFB-MNHN-CNRS-IRD), Paris	
3aa547ec-a9fd-497e-825d-d7caa6b4b06b	[SUIVI] 2021 - Exploitation de la carrière de la société BABOUILLARD Michel SARL - Insectes - ENCEM - Coulmier-le-sec - 2021	1928bdf0-f5d2-11dc-8c12-b8a03c50a862	UAR PatriNat (OFB-MNHN-CNRS-IRD), Paris	
8df34ba7-d372-41f2-9542-e37b617f6c39	PROJET D’AGRANDISSEMENT DE LA BASE LOGISTIQUE INTERMARCHE DE SAINTHILAIRE- LES-ANDRESIS - Données Flore - IEA	1928bdf0-f5d2-11dc-8c12-b8a03c50a862	UAR PatriNat (OFB-MNHN-CNRS-IRD), Paris	
9d7d3af2-56eb-4721-bc47-689bea7aa529	PROJET D’AGRANDISSEMENT DE LA BASE LOGISTIQUE INTERMARCHE DE SAINTHILAIRE- LES-ANDRESIS - Données Faune - IEA	1928bdf0-f5d2-11dc-8c12-b8a03c50a862	UAR PatriNat (OFB-MNHN-CNRS-IRD), Paris	
34ca940f-facb-4039-9ac0-111dad7fd9cc	Inventario y base de datos de los líquenes de la selva seca de Jalisco	ff90b050-c256-11db-b71b-b8a03c50a862	Comisión nacional para el conocimiento y uso de la biodiversidad	
b50ac77f-7b87-42e0-a1eb-220b3c65f4ca	Renouvellement du plan de gestion de l'ENS du Domaine de Montauger et ses abords	1928bdf0-f5d2-11dc-8c12-b8a03c50a862	UAR PatriNat (OFB-MNHN-CNRS-IRD), Paris	
17a45304-9866-4198-bb4f-c04f8cadde22	Contribution à la connaissance des Orthoptères – Locusta-Données opportunistes de Nicolas Pinczon-du-sel	1928bdf0-f5d2-11dc-8c12-b8a03c50a862	UAR PatriNat (OFB-MNHN-CNRS-IRD), Paris	
ef83dc70-f6c9-4eb0-8a0a-29a738f58f9b	Vegetación asociada al cerro Alto marrano, municipio de Pueblo Rico, Risaralda. 2018	e1050db2-9faf-4d72-b860-295debaf9d2a	Instituto de Investigaciones Ambientales del Pacífico John Von Neumann - IIAP	
2a45b639-c604-49ea-b3e9-e01dfacdd726	Caracterización florística del cerro Alto Santa Fe, Guarato, 2019	e1050db2-9faf-4d72-b860-295debaf9d2a	Instituto de Investigaciones Ambientales del Pacífico John Von Neumann - IIAP	
8ff54e62-bc79-4e39-b17a-ca1352af1dd8	Projet éolien (SEPE Les Mottes) sur les Communes de Aumâtre et Fontaine-le-Sec - chiroptères inventaire complémentaire	1928bdf0-f5d2-11dc-8c12-b8a03c50a862	UAR PatriNat (OFB-MNHN-CNRS-IRD), Paris	
7211a0b6-b33e-474f-98dd-0ed1964fea38	Occurrences of vascular plants in Utrish Reserve, Russia	e3aee9f3-c608-46ad-843a-721ae11d1e83	Utrish State Nature Reserve	
58808668-8f74-4fdf-a628-76a32e60e0ce	Colección de Invertebrados Museo de La Salle Bogotá (MLS)	478a9e81-e716-42dc-a68d-03487953a32e	Universidad de la Salle	
31ac4935-0546-4ffe-9a45-79d6861a5b05	Données produites ou récoltées par le GCLR dans le cadre  de ses activités (sans métadonnées)	1928bdf0-f5d2-11dc-8c12-b8a03c50a862	UAR PatriNat (OFB-MNHN-CNRS-IRD), Paris	
221a99ab-a294-46db-bad7-8173db481213	CTMA de la Vienne médiane et ses affluents 2015-2020-Zones humides de Bos Fiatu	1928bdf0-f5d2-11dc-8c12-b8a03c50a862	UAR PatriNat (OFB-MNHN-CNRS-IRD), Paris	
454c4740-99ae-40d8-a713-8d026cd1049b	Mutualisation des données ZNIEFF en ex-Limousin-Données produites par le SEL sur les ZNIEFFs	1928bdf0-f5d2-11dc-8c12-b8a03c50a862	UAR PatriNat (OFB-MNHN-CNRS-IRD), Paris	
7afe91dc-2706-499d-806a-b7e48c241125	Mutualisation des données ZNIEFF en ex-Limousin-Données produites par le SEL sur les ZNIEFFs	1928bdf0-f5d2-11dc-8c12-b8a03c50a862	UAR PatriNat (OFB-MNHN-CNRS-IRD), Paris	
8315aecd-b5a6-4b75-af3e-acb8600a7859	Études entomologiques pilotées par la Société entomologique Antilles-Guyane - Inventaire par piégeage des Coléoptères Phanaeini de Guyane (SEAG)	1928bdf0-f5d2-11dc-8c12-b8a03c50a862	UAR PatriNat (OFB-MNHN-CNRS-IRD), Paris	sea
a73d9e11-def6-4644-88fd-8cc40d9b8ffe	Études entomologiques pilotées par la Société entomologique Antilles-Guyane-Observations naturalistes et collection entomologique en Guyane (SEAG, Julien Touroult)	1928bdf0-f5d2-11dc-8c12-b8a03c50a862	UAR PatriNat (OFB-MNHN-CNRS-IRD), Paris	sea
6b373f78-5f73-453f-8894-7aafaf7231fb	Projet d'interconnexion électrique France - Espagne par le golfe de Gascogne - Données brutes de biodiversité GDG IEA	1928bdf0-f5d2-11dc-8c12-b8a03c50a862	UAR PatriNat (OFB-MNHN-CNRS-IRD), Paris	
2f7cab3e-cd7f-4cf0-999b-51044cc63470	Plan d'action sur les plantes exotiques envahissantes en Midi-Pyrénées-Données sur les plantes exotiques envahissantes saisies dans l'outil web SEE	1928bdf0-f5d2-11dc-8c12-b8a03c50a862	UAR PatriNat (OFB-MNHN-CNRS-IRD), Paris	
7c5b64db-47b7-4f86-8f7f-27ead12808a7	Regroupement d'études et inventaires opportunistes de la Société Entomologique du Limousin (SEL)-Occurrences Dermaptères en Limousin	1928bdf0-f5d2-11dc-8c12-b8a03c50a862	UAR PatriNat (OFB-MNHN-CNRS-IRD), Paris	
901cd48b-5514-442a-95c7-78d06cee9203	CardObs : Observations naturalistes issues de l'outil CardObs-Inventaire du Parc des Beaumonts (Montreuil) et ses environs	1928bdf0-f5d2-11dc-8c12-b8a03c50a862	UAR PatriNat (OFB-MNHN-CNRS-IRD), Paris	
424c2bbf-e40b-46e6-a19e-69235d7d29b3	Occurrence data set of Non-Timber Forest Products species for medicinal purposes in Zimbabwe’s biodiversity hotspots	30e59560-2a13-41cb-bfb2-4cc567c8698f	Bindura University Of Science Education	
9b8b786c-9d18-4a6d-bada-fd4d6eec05f5	Macroinvertebrados acuáticos presentes en la ciénaga de montaño, Carmen del Darién, 2020	e1050db2-9faf-4d72-b860-295debaf9d2a	Instituto de Investigaciones Ambientales del Pacífico John Von Neumann - IIAP	
8304ec0a-ddc1-4f79-9d76-e38c6096cc1c	Ictiofauna presente en fuentes hídricas del Cerro Cuchillo, Riosucio, Chocó. 2017	e1050db2-9faf-4d72-b860-295debaf9d2a	Instituto de Investigaciones Ambientales del Pacífico John Von Neumann - IIAP	
4290f5c2-4c0c-4510-a153-86a42b64131c	Herbarium of the Katon–Karagai State National Nature Park	943a5811-d56e-4c37-853d-bd64957d3833	Altai State University	
5bc563b4-cce4-4a63-8e6f-ac7cd1936a72	Projet éolien (SEPE Les Mottes) sur les Communes de Aumâtre et Fontaine-le-Sec - Oiseaux - Points d'écoute	1928bdf0-f5d2-11dc-8c12-b8a03c50a862	UAR PatriNat (OFB-MNHN-CNRS-IRD), Paris	sea
b4e1c7bc-aa91-447e-a979-b20fd4e2fb8f	Regroupement d'études et inventaires opportunistes de la Société Entomologique du Limousin (SEL)-Occurrences coléoptères Geotrupidae en Limousin	1928bdf0-f5d2-11dc-8c12-b8a03c50a862	UAR PatriNat (OFB-MNHN-CNRS-IRD), Paris	
01481ba2-cf0f-40ef-bdc9-8e16c4d985d2	Nouveau pont du Larivot sur la rivière de Cayenne et ses raccordements à la RN1 bidirectionnelle - Biotope_OISEAU_INV	1928bdf0-f5d2-11dc-8c12-b8a03c50a862	UAR PatriNat (OFB-MNHN-CNRS-IRD), Paris	sea
5c3be7ed-f191-4eb7-87b5-9f2e1006eff6	Regroupement d'études et inventaires opportunistes de la Société Entomologique du Limousin (SEL)-données limousines hymeno JM Sibert	1928bdf0-f5d2-11dc-8c12-b8a03c50a862	UAR PatriNat (OFB-MNHN-CNRS-IRD), Paris	
026eadb6-1b59-4e6f-8874-0b623c7a4481	Nouveau pont du Larivot sur la rivière de Cayenne et ses raccordements à la RN1 bidirectionnelle - GEPOG_OISEAU_INV	1928bdf0-f5d2-11dc-8c12-b8a03c50a862	UAR PatriNat (OFB-MNHN-CNRS-IRD), Paris	sea
d088ff6c-1b7a-446a-b21f-6ca771e5a550	Nouveau pont du Larivot sur la rivière de Cayenne et ses raccordements à la RN1 bidirectionnelle - Biotope_FLORE_INV	1928bdf0-f5d2-11dc-8c12-b8a03c50a862	UAR PatriNat (OFB-MNHN-CNRS-IRD), Paris	
1404d8b3-362e-4f91-93fd-05cd3b9ad38f	Nouveau pont du Larivot sur la rivière de Cayenne et ses raccordements à la RN1 bidirectionnelle - Biotope_AMPHI_INV	1928bdf0-f5d2-11dc-8c12-b8a03c50a862	UAR PatriNat (OFB-MNHN-CNRS-IRD), Paris	
c414e691-da52-4820-9ce4-3fd203f586dd	Nouveau pont du Larivot sur la rivière de Cayenne et ses raccordements à la RN1 bidirectionnelle - GEPOG_MAMMIF_INV	1928bdf0-f5d2-11dc-8c12-b8a03c50a862	UAR PatriNat (OFB-MNHN-CNRS-IRD), Paris	
6c3ce2a4-c5d7-4c2f-9dd5-3623666b9b96	Nouveau pont du Larivot sur la rivière de Cayenne et ses raccordements à la RN1 bidirectionnelle - GEPOG_POISSON_INV	1928bdf0-f5d2-11dc-8c12-b8a03c50a862	UAR PatriNat (OFB-MNHN-CNRS-IRD), Paris	
6ec0cd2d-5fc3-4319-b5ed-90c8817eab2b	Nouveau pont du Larivot sur la rivière de Cayenne et ses raccordements à la RN1 bidirectionnelle - GEPOG_REPTILE_INV	1928bdf0-f5d2-11dc-8c12-b8a03c50a862	UAR PatriNat (OFB-MNHN-CNRS-IRD), Paris	
08599f92-02c1-4219-b7b7-0b450514cafe	Nouveau pont du Larivot sur la rivière de Cayenne et ses raccordements à la RN1 bidirectionnelle - Uriot_CHIRO_INV	1928bdf0-f5d2-11dc-8c12-b8a03c50a862	UAR PatriNat (OFB-MNHN-CNRS-IRD), Paris	
337bb331-6fda-4ab9-83a3-7f858d207ea4	Nouveau pont du Larivot sur la rivière de Cayenne et ses raccordements à la RN1 bidirectionnelle - FG_AMPHI_INV	1928bdf0-f5d2-11dc-8c12-b8a03c50a862	UAR PatriNat (OFB-MNHN-CNRS-IRD), Paris	
f1301765-34d3-4253-bac0-68cb52c9093f	Nouveau pont du Larivot sur la rivière de Cayenne et ses raccordements à la RN1 bidirectionnelle - FG_MAMMIF_INV	1928bdf0-f5d2-11dc-8c12-b8a03c50a862	UAR PatriNat (OFB-MNHN-CNRS-IRD), Paris	
6af93d2c-f1e7-4de5-8395-72c52637ba6b	Nouveau pont du Larivot sur la rivière de Cayenne et ses raccordements à la RN1 bidirectionnelle - FG_REPTILE_INV	1928bdf0-f5d2-11dc-8c12-b8a03c50a862	UAR PatriNat (OFB-MNHN-CNRS-IRD), Paris	
af65465e-948f-4828-bb9c-107469b6c23f	Nouveau pont du Larivot sur la rivière de Cayenne et ses raccordements à la RN1 bidirectionnelle - GCG_CHIRO_INV	1928bdf0-f5d2-11dc-8c12-b8a03c50a862	UAR PatriNat (OFB-MNHN-CNRS-IRD), Paris	
e267cad3-18c7-4719-9cc2-c58c263c87ed	Nouveau pont du Larivot sur la rivière de Cayenne et ses raccordements à la RN1 bidirectionnelle - GCG_MAMMIF_INV	1928bdf0-f5d2-11dc-8c12-b8a03c50a862	UAR PatriNat (OFB-MNHN-CNRS-IRD), Paris	
c3308998-4bde-45d3-a72e-eb72b36de9ed	Nouveau pont du Larivot sur la rivière de Cayenne et ses raccordements à la RN1 bidirectionnelle - HYDRECO_MOLLUSQUE_INV	1928bdf0-f5d2-11dc-8c12-b8a03c50a862	UAR PatriNat (OFB-MNHN-CNRS-IRD), Paris	
d10e4cf3-e596-4a8d-8897-2e63e5d3852d	Nouveau pont du Larivot sur la rivière de Cayenne et ses raccordements à la RN1 bidirectionnelle - Biotope_CHIRO_INV	1928bdf0-f5d2-11dc-8c12-b8a03c50a862	UAR PatriNat (OFB-MNHN-CNRS-IRD), Paris	
1f0963eb-5806-46f0-a56e-a25b0aa27716	Nouveau pont du Larivot sur la rivière de Cayenne et ses raccordements à la RN1 bidirectionnelle - Biotope_CHIRO_OPPORT	1928bdf0-f5d2-11dc-8c12-b8a03c50a862	UAR PatriNat (OFB-MNHN-CNRS-IRD), Paris	
91e443f4-bcdc-4143-be15-a13c83f8a39e	Nouveau pont du Larivot sur la rivière de Cayenne et ses raccordements à la RN1 bidirectionnelle - Biotope_MAMMIF_INV	1928bdf0-f5d2-11dc-8c12-b8a03c50a862	UAR PatriNat (OFB-MNHN-CNRS-IRD), Paris	
10e8f89e-643a-47da-a9c9-0e67fa64dfee	Nouveau pont du Larivot sur la rivière de Cayenne et ses raccordements à la RN1 bidirectionnelle - Biotope_POISSON_INV	1928bdf0-f5d2-11dc-8c12-b8a03c50a862	UAR PatriNat (OFB-MNHN-CNRS-IRD), Paris	
23a8e09d-061d-415d-ba86-1e0853309dd8	Nouveau pont du Larivot sur la rivière de Cayenne et ses raccordements à la RN1 bidirectionnelle - Biotope_REPTILE_INV	1928bdf0-f5d2-11dc-8c12-b8a03c50a862	UAR PatriNat (OFB-MNHN-CNRS-IRD), Paris	
1c6bb890-6f39-4f79-980f-392a4d1174d9	Mutualisation des données ZNIEFF en ex-Limousin-Données transférées de la SEL à LNE pour les ZNIEFF	1928bdf0-f5d2-11dc-8c12-b8a03c50a862	UAR PatriNat (OFB-MNHN-CNRS-IRD), Paris	
cd31232e-57a9-4777-ab9d-406333c42769	Nouveau pont du Larivot sur la rivière de Cayenne et ses raccordements à la RN1 bidirectionnelle - HYDRECO_ICHTYO_INV	1928bdf0-f5d2-11dc-8c12-b8a03c50a862	UAR PatriNat (OFB-MNHN-CNRS-IRD), Paris	
8abed1d1-364e-4f69-aea8-2932a744d4f9	Nouveau pont du Larivot sur la rivière de Cayenne et ses raccordements à la RN1 bidirectionnelle - HYDRECO_CRUSTACEAE_INV	1928bdf0-f5d2-11dc-8c12-b8a03c50a862	UAR PatriNat (OFB-MNHN-CNRS-IRD), Paris	
7d0fc7c6-2b5a-45ee-ab93-dadc06c30ffa	Data set: Only-presence data for wild ungulates and red fox in Spain based on hunting yields	2e5b488d-52e2-4f80-862b-0a60517e3f50	Instituto de Investigación en Recursos Cinegéticos (IREC /CSIC-UCLM-JCCM)	
2a0f0847-7277-4f5e-b051-68ac0ceed89e	Dynamics of Bird Communities in South-Eastern Ukraine (1987–2017)	c8ac507d-0869-4792-9c3a-6f2e60c2b1de	Bohdan Khmelnytsky Melitopol State Pedagogical University	
da4214de-9415-4ccd-8da5-1b456c73a144	Siewierz Forest District Lepidoptera Collection	cdf03d52-7a65-40c1-b8c3-ace7e180706e	Państwowe Gospodarstwo Leśne  Lasy Państwowe  Nadleśnictwo Siewierz	
3d05b094-6ab4-4d47-8ba8-0d6fc51655e0	Computarización de la colección de insectos de la Universidad de Morelos, CIByC, UAEM	ff90b050-c256-11db-b71b-b8a03c50a862	Comisión nacional para el conocimiento y uso de la biodiversidad	
3eb94dd5-c5d2-4a55-947c-7a4d3535ced8	Bioblitz 2014 Kalvebod Fælled, Denmark	2e7df380-8356-4533-bcb3-5459e23c794e	Natural History Museum of Denmark	
b4320ef2-9abb-4f3c-a3b7-33120fdbb715	Database and digitization of bees from TIGER project (Thailand)	57d75cbe-04e9-4d85-ae73-03674b041849	Chulalongkorn University, Department of Biology	
ceb3e4ee-65a1-478e-bf74-ad74a49099c8	Especies forestales presentes en el cerro Yerrecuí, municipio de Tadó, Chocó. 2022	e1050db2-9faf-4d72-b860-295debaf9d2a	Instituto de Investigaciones Ambientales del Pacífico John Von Neumann - IIAP	
37f002f3-95c1-4b43-bac8-79f19665e850	Especies herbáceas presentes en el cerro Yerrecuí, municipio de Tadó, Chocó. 2022	e1050db2-9faf-4d72-b860-295debaf9d2a	Instituto de Investigaciones Ambientales del Pacífico John Von Neumann - IIAP	
